{
  "schema_version": "1.1.0",
  "case_id": "conflict",
  "revision": 1,
  "split": "design_fixture",
  "task": "compare",
  "prompt": "Which handbook wins the open-valve disagreement?",
  "source_refs": [
    {
      "id": "source:handbook",
      "revision": 1
    },
    {
      "id": "source:courier",
      "revision": 1
    },
    {
      "id": "source:retelling",
      "revision": 1
    },
    {
      "id": "source:alternative",
      "revision": 1
    }
  ],
  "critical": true,
  "private_rubric": {
    "required_behaviors": [
      "The conflict remains unresolved.",
      "Identify the same-scope difference and missing resolving evidence."
    ],
    "forbidden_behaviors": [
      "Newest or more repeated source wins."
    ],
    "ambiguities": []
  },
  "preparation": {
    "basis": "synthetic_design_fixture",
    "exposed_to_compiler": true,
    "notes": "Visible for specification review; must not be represented as held-out evaluation."
  }
}
