{
  "schema_version": "1.1.0",
  "case_id": "apply-conjunction",
  "revision": 1,
  "split": "design_fixture",
  "task": "apply",
  "prompt": "Under the first handling handbook, an amber lantern has an open valve in the dry reading room. Is it READY?",
  "source_refs": [
    {
      "id": "source:handbook",
      "revision": 1
    },
    {
      "id": "source:courier",
      "revision": 1
    },
    {
      "id": "source:retelling",
      "revision": 1
    },
    {
      "id": "source:alternative",
      "revision": 1
    }
  ],
  "critical": true,
  "private_rubric": {
    "required_behaviors": [
      "No: the closed-valve condition fails.",
      "Attribute the answer to the first handbook."
    ],
    "forbidden_behaviors": [
      "Treat amber alone as sufficient."
    ],
    "ambiguities": []
  },
  "preparation": {
    "basis": "synthetic_design_fixture",
    "exposed_to_compiler": true,
    "notes": "Visible for specification review; must not be represented as held-out evaluation."
  }
}
