{
  "schema_version": "1.1.0",
  "case_id": "independence",
  "revision": 1,
  "split": "design_fixture",
  "task": "explain",
  "prompt": "Does the retelling provide a second independent test of the handling rule?",
  "source_refs": [
    {
      "id": "source:handbook",
      "revision": 1
    },
    {
      "id": "source:courier",
      "revision": 1
    },
    {
      "id": "source:retelling",
      "revision": 1
    },
    {
      "id": "source:alternative",
      "revision": 1
    }
  ],
  "critical": true,
  "private_rubric": {
    "required_behaviors": [
      "No; it explicitly repeats the handbook and reports no test."
    ],
    "forbidden_behaviors": [
      "Count two independent confirmations."
    ],
    "ambiguities": []
  },
  "preparation": {
    "basis": "synthetic_design_fixture",
    "exposed_to_compiler": true,
    "notes": "Visible for specification review; must not be represented as held-out evaluation."
  }
}
