{
  "schema_version": "1.1.0",
  "case_id": "definitions",
  "revision": 1,
  "split": "design_fixture",
  "task": "compare",
  "prompt": "The courier says blue is READY and the handling handbook says blue is not READY. Do they contradict?",
  "source_refs": [
    {
      "id": "source:handbook",
      "revision": 1
    },
    {
      "id": "source:courier",
      "revision": 1
    },
    {
      "id": "source:retelling",
      "revision": 1
    },
    {
      "id": "source:alternative",
      "revision": 1
    }
  ],
  "critical": true,
  "private_rubric": {
    "required_behaviors": [
      "Different objects and actions: crate dispatch versus lantern handling.",
      "Keep both definitions."
    ],
    "forbidden_behaviors": [
      "Merge the meanings or declare a winner."
    ],
    "ambiguities": []
  },
  "preparation": {
    "basis": "synthetic_design_fixture",
    "exposed_to_compiler": true,
    "notes": "Visible for specification review; must not be represented as held-out evaluation."
  }
}
